"Title","Orders Count","Rating","Votes Count","Url","Price"
"183*61 cm Padrão Waffle Toalha de Yoga Bikram Yoga Quente Esteira da Aptidão Antiderrapante Cobertor Mat Pilates Exercício Ao Ar Livre Tapete de Yoga toalha","1","","","https://pt.aliexpress.com/item/183-61cm-Waffle-Pattern-Yoga-Towel-Fitness-Bikram-Hot-Yoga-Mat-Non-Slip-Blanket-Exercise-Pilates/32822746391.html?ws_ab_test=searchweb0_0,searchweb201602_4_10065_10068_318_10547_319_10548_10696_450_10084_10083_10618_452_535_534_533_10307_532_204_10059_10884_10887_100031_320_10103_448_449,searchweb201603_60,ppcSwitch_0&algo_expid=1205acb2-dfe6-4dae-87b8-14b37dc04d97-42&algo_pvid=1205acb2-dfe6-4dae-87b8-14b37dc04d97","61,40"
"Rainbow Stripes microfibra Tecido Quadrado Colorido Toalha de Praia Cachecol Protetor Solar de Secagem rápida Yoga Cobertor Tapete Tapeçaria mulheres praia","1","5.0","1","https://pt.aliexpress.com/item/Microfiber-Fabric-Square-Colorful-Beach-Towel-Rainbow-Stripes-Scarf-Sunscreen-Quick-Dry-Yoga-Blanket-Mat-Tapestry/32890332602.html?ws_ab_test=searchweb0_0,searchweb201602_4_10065_10068_318_10547_319_10548_10696_450_10084_10083_10618_452_535_534_533_10307_532_204_10059_10884_10887_100031_320_10103_448_449,searchweb201603_60,ppcSwitch_0&algo_expid=1205acb2-dfe6-4dae-87b8-14b37dc04d97-43&algo_pvid=1205acb2-dfe6-4dae-87b8-14b37dc04d97","30,50"
"Gosweat Hot Yoga Towel-74x28 Polegada, Altamente Absorvente, Confortável, Não-Slip, Portátil, CAMURÇA, melhor Bikram/Yoga QUENTE","3","","","https://pt.aliexpress.com/item/Gosweat-Hot-Yoga-Towel-74x28-Inch-High-Absorbent-Comfortable-Non-Slip-Portable-SUEDE-Best-Bikram-HOT/32903740359.html?ws_ab_test=searchweb0_0,searchweb201602_4_10065_10068_318_10547_319_10548_10696_450_10084_10083_10618_452_535_534_533_10307_532_204_10059_10884_10887_100031_320_10103_448_449,searchweb201603_60,ppcSwitch_0&algo_expid=1205acb2-dfe6-4dae-87b8-14b37dc04d97-44&algo_pvid=1205acb2-dfe6-4dae-87b8-14b37dc04d97","123,75"
"Tapete de Yoga Impressão 3D Tampa Esporte Terno Yoga Cobertor Toalha Yoga Mat Pilates Antiderrapante Exercício de Fitness Workout","4","5.0","2","https://pt.aliexpress.com/item/3D-Print-Yoga-Towel-Yoga-Pilates-Mat-Cover-Sport-Yoga-Blanket-Nonslip-Fitness-Exercise-Workout-Yoga/32698272708.html?ws_ab_test=searchweb0_0,searchweb201602_4_10065_10068_318_10547_319_10548_10696_450_10084_10083_10618_452_535_534_533_10307_532_204_10059_10884_10887_100031_320_10103_448_449,searchweb201603_60,ppcSwitch_0&algo_expid=1205acb2-dfe6-4dae-87b8-14b37dc04d97-45&algo_pvid=1205acb2-dfe6-4dae-87b8-14b37dc04d97","106,11"
"Anti-slip Yoga Cobertores Toalha Confortável Esportes Aptidão Exercício GYM Yoga Pilates Mat Cobertor Cobertura Absorver O Suor Toalha 183x61 cm","2","","","https://pt.aliexpress.com/item/Anti-slip-Yoga-Blankets-Towel-Comfortable-Sports-Fitness-Exercise-GYM-Yoga-Pilates-Mat-Cover-Blanket-Absorb/32921876552.html?ws_ab_test=searchweb0_0,searchweb201602_4_10065_10068_318_10547_319_10548_10696_450_10084_10083_10618_452_535_534_533_10307_532_204_10059_10884_10887_100031_320_10103_448_449,searchweb201603_60,ppcSwitch_0&algo_expid=1205acb2-dfe6-4dae-87b8-14b37dc04d97-46&algo_pvid=1205acb2-dfe6-4dae-87b8-14b37dc04d97","57,29"
"1X Banhos de Sol de Verão Toalha de Praia Toalhas de banho Tapetes tapete de Piquenique Ao Ar Livre Banho de Sol Vestido de Praia Do Bebê Cobertor Cobertor de Viagem Rodada","","3.0","1","https://pt.aliexpress.com/item/1X-Summer-Sunlight-Baths-Towel-Beach-Swimming-Towels-Picnic-Mats-Outdoor-Sunbath-Beach-Dress-Baby-Blanket/32679420900.html?ws_ab_test=searchweb0_0,searchweb201602_4_10065_10068_318_10547_319_10548_10696_450_10084_10083_10618_452_535_534_533_10307_532_204_10059_10884_10887_100031_320_10103_448_449,searchweb201603_60,ppcSwitch_0&algo_expid=1205acb2-dfe6-4dae-87b8-14b37dc04d97-47&algo_pvid=1205acb2-dfe6-4dae-87b8-14b37dc04d97","32,10"
