"Title","Orders Count","Rating","Votes Count","Url","Price"
"TPE Yoga Pilates Círculos Forma Cintura Musculação Profissional ABS Roda Traseira Ferramenta de Treinamento Para Fitness Gym Workout Yoga Dança","313","4.9","88","https://pt.aliexpress.com/item/TPE-Yoga-Circles-Pilates-Professional-Waist-Shape-Bodybuilding-ABS-Gym-Workout-Yoga-Wheel-Back-Training-Tool/32889368226.html?ws_ab_test=searchweb0_0,searchweb201602_3_10065_10068_318_10547_319_10548_10696_450_10084_10083_10618_452_535_534_533_10307_532_204_10059_10884_10887_100031_320_10103_448_449,searchweb201603_60,ppcSwitch_0&algo_expid=e041bf52-01fa-476a-a919-b14e63709ca0-0&algo_pvid=e041bf52-01fa-476a-a919-b14e63709ca0&transAbTest=ae803_5","75,97"
"Qualidade Yoga Pilates Anel Mágico Envoltório de Emagrecimento Corpo de Formação Construção Heavy Duty PP + Material de NBR Yoga Círculo 5 cores","15","","","https://pt.aliexpress.com/item/Quality-Yoga-Pilates-Ring-Magic-Wrap-Slimming-Body-Building-Training-Heavy-Duty-PP-NBR-Material-Yoga/32923886847.html?ws_ab_test=searchweb0_0,searchweb201602_3_10065_10068_318_10547_319_10548_10696_450_10084_10083_10618_452_535_534_533_10307_532_204_10059_10884_10887_100031_320_10103_448_449,searchweb201603_60,ppcSwitch_0&algo_expid=e041bf52-01fa-476a-a919-b14e63709ca0-1&algo_pvid=e041bf52-01fa-476a-a919-b14e63709ca0&transAbTest=ae803_5","28,31"
"Roda de madeira Yoga Pilates com Círculos de Buddha Lótus Profissional TPE Yoga Gym Workout Treinamento de Volta Ferramenta Para Musculação Aptidão","20","","","https://pt.aliexpress.com/item/Wood-Yoga-Wheel-Pilates-with-Buddha-Lotus-Professional-TPE-Yoga-Circles-Gym-Workout-Back-Training-Tool/32921928167.html?ws_ab_test=searchweb0_0,searchweb201602_3_10065_10068_318_10547_319_10548_10696_450_10084_10083_10618_452_535_534_533_10307_532_204_10059_10884_10887_100031_320_10103_448_449,searchweb201603_60,ppcSwitch_0&algo_expid=e041bf52-01fa-476a-a919-b14e63709ca0-2&algo_pvid=e041bf52-01fa-476a-a919-b14e63709ca0&transAbTest=ae803_5","79,00"
"Yoga Pilates Círculos Forma Cintura Musculação Profissional ABS Roda Traseira Ferramenta de Treinamento Para Fitness Gym Workout Yoga","19","","","https://pt.aliexpress.com/item/Yoga-Circles-Pilates-Professional-Waist-Shape-Bodybuilding-ABS-Gym-Workout-Yoga-Wheel-Back-Training-Tool/32922721901.html?ws_ab_test=searchweb0_0,searchweb201602_3_10065_10068_318_10547_319_10548_10696_450_10084_10083_10618_452_535_534_533_10307_532_204_10059_10884_10887_100031_320_10103_448_449,searchweb201603_60,ppcSwitch_0&algo_expid=e041bf52-01fa-476a-a919-b14e63709ca0-3&algo_pvid=e041bf52-01fa-476a-a919-b14e63709ca0&transAbTest=ae803_5","74,69 - 76,81"
"Ponto Montado Blocos de Yoga Rolo de Espuma de EVA para Fitness Ginásio Pilates Exercícios Em Casa Fisioterapia Massagem Tamanho 33*14 cm","78","5.0","30","https://pt.aliexpress.com/item/2-5-LCD-HD-3-Mega-Pixels-DVR-Motion-Detection-6-LED-Night-Sight-120-Degree/32608555590.html?ws_ab_test=searchweb0_0,searchweb201602_3_10065_10068_318_10547_319_10548_10696_450_10084_10083_10618_452_535_534_533_10307_532_204_10059_10884_10887_100031_320_10103_448_449,searchweb201603_60,ppcSwitch_0&algo_expid=e041bf52-01fa-476a-a919-b14e63709ca0-4&algo_pvid=e041bf52-01fa-476a-a919-b14e63709ca0&transAbTest=ae803_5","19,92"
"Yoga Pilates Anel Mágico Envoltório Slimming a Construção Do Corpo de Treinamento Yoga Círculo","172","4.8","77","https://pt.aliexpress.com/item/Yoga-Pilates-Ring-Magic-Wrap-Slimming-Body-Building-Training-Yoga-Circle/32833903504.html?ws_ab_test=searchweb0_0,searchweb201602_3_10065_10068_318_10547_319_10548_10696_450_10084_10083_10618_452_535_534_533_10307_532_204_10059_10884_10887_100031_320_10103_448_449,searchweb201603_60,ppcSwitch_0&algo_expid=e041bf52-01fa-476a-a919-b14e63709ca0-5&algo_pvid=e041bf52-01fa-476a-a919-b14e63709ca0&transAbTest=ae803_5","34,93"
"Yoga Círculo Anel de Mulheres Em Casa Equipamentos de Fitness Yoga Stretchdline Fascia Massagem Pilates Workout Exercício de Musculação","6","","","https://pt.aliexpress.com/item/Yoga-Circle-Yoga-Stretchdline-Ring-Home-Women-Fitness-Equipment-Fascia-Massage-Workout-Pilates-Bodybuilding-Exercise/32925896720.html?ws_ab_test=searchweb0_0,searchweb201602_3_10065_10068_318_10547_319_10548_10696_450_10084_10083_10618_452_535_534_533_10307_532_204_10059_10884_10887_100031_320_10103_448_449,searchweb201603_60,ppcSwitch_0&algo_expid=e041bf52-01fa-476a-a919-b14e63709ca0-6&algo_pvid=e041bf52-01fa-476a-a919-b14e63709ca0&transAbTest=ae803_5","4,80"
"Multi-função Yoga Prop Círculo Roda Rodas Rolo de Massagem Mais Confortável Massagem Nas Costas Alongamento Venda Quente","8","5.0","6","https://pt.aliexpress.com/item/Multi-function-Yoga-Wheel-Massage-Roller-Most-Comfortable-Back-Massage-Prop-Wheel-Circle-Stretching-For-Office/32804693036.html?ws_ab_test=searchweb0_0,searchweb201602_3_10065_10068_318_10547_319_10548_10696_450_10084_10083_10618_452_535_534_533_10307_532_204_10059_10884_10887_100031_320_10103_448_449,searchweb201603_60,ppcSwitch_0&algo_expid=e041bf52-01fa-476a-a919-b14e63709ca0-7&algo_pvid=e041bf52-01fa-476a-a919-b14e63709ca0&transAbTest=ae803_5","121,04 - 121,40"
"Rolo de espuma yoga pilates ginásio acessórios roda rodas Não-deslizamento em casa equipamentos de fitness yoga yoga Pilates ABS Círculo rolos","","","","https://pt.aliexpress.com/item/Yoga-pilates-foam-roller-gym-accessories-yoga-wheel-home-fitness-equipment-Yoga-wheels-Non-slip-ABS/32922376265.html?s=p&ws_ab_test=searchweb0_0,searchweb201602_3_10065_10068_318_10547_319_10548_10696_450_10084_10083_10618_452_535_534_533_10307_532_204_10059_10884_10887_100031_320_10103_448_449,searchweb201603_60,ppcSwitch_0&algo_expid=e041bf52-01fa-476a-a919-b14e63709ca0-8&algo_pvid=e041bf52-01fa-476a-a919-b14e63709ca0&transAbTest=ae803_5","145,51"
"Disco 1 pcs Durável Inflável Yoga Wobble Estabilidade Equilíbrio Disco Almofada de Massagem Mat F $","9","4.5","2","https://pt.aliexpress.com/item/1pcs-Durable-Inflatable-Yoga-disk-Wobble-Stability-Balance-Disc-Massage-Cushion-Mat-F/32903974342.html?ws_ab_test=searchweb0_0,searchweb201602_3_10065_10068_318_10547_319_10548_10696_450_10084_10083_10618_452_535_534_533_10307_532_204_10059_10884_10887_100031_320_10103_448_449,searchweb201603_60,ppcSwitch_0&algo_expid=e041bf52-01fa-476a-a919-b14e63709ca0-9&algo_pvid=e041bf52-01fa-476a-a919-b14e63709ca0&transAbTest=ae803_5","36,89 - 57,13"
"TPE Yoga Pilates Círculos Forma Cintura Musculação Profissional ABS Roda Traseira Ferramenta de Treinamento Para Fitness Gym Workout Yoga","170","5.0","22","https://pt.aliexpress.com/item/TPE-Yoga-Circles-Pilates-Professional-Waist-Shape-Bodybuilding-ABS-Gym-Workout-Yoga-Wheel-Back-Training-Tool/32890543014.html?ws_ab_test=searchweb0_0,searchweb201602_3_10065_10068_318_10547_319_10548_10696_450_10084_10083_10618_452_535_534_533_10307_532_204_10059_10884_10887_100031_320_10103_448_449,searchweb201603_60,ppcSwitch_0&algo_expid=e041bf52-01fa-476a-a919-b14e63709ca0-10&algo_pvid=e041bf52-01fa-476a-a919-b14e63709ca0&transAbTest=ae803_5","75,97"
"ProCircle Paralelepípedos Bloco de Yoga Rolo De Espuma Yoga Para Massagem e Fisioterapia Fitness","197","4.9","93","https://pt.aliexpress.com/item/ProCircle-Cobblestone-Foam-Roller-Yoga-Block-For-Yoga-Massage-and-Fitness-Physical-Therapy/32854918089.html?ws_ab_test=searchweb0_0,searchweb201602_3_10065_10068_318_10547_319_10548_10696_450_10084_10083_10618_452_535_534_533_10307_532_204_10059_10884_10887_100031_320_10103_448_449,searchweb201603_60,ppcSwitch_0&algo_expid=e041bf52-01fa-476a-a919-b14e63709ca0-11&algo_pvid=e041bf52-01fa-476a-a919-b14e63709ca0&transAbTest=ae803_5","119,72"
"Novo Dual Grip Kit Círculo Mágico Anel de Yoga Pilates para o Exercício Do Músculo Músculos Do Corpo Yoga Exercício de Fitness Ferramenta Dropship 4 cores","63","4.8","16","https://pt.aliexpress.com/item/New-Dual-Grip-Yoga-Pilates-Ring-for-Muscle-Exercise-Kit-Magic-Circle-Muscles-Body-Exercise-Yoga/32903916556.html?ws_ab_test=searchweb0_0,searchweb201602_3_10065_10068_318_10547_319_10548_10696_450_10084_10083_10618_452_535_534_533_10307_532_204_10059_10884_10887_100031_320_10103_448_449,searchweb201603_60,ppcSwitch_0&algo_expid=e041bf52-01fa-476a-a919-b14e63709ca0-12&algo_pvid=e041bf52-01fa-476a-a919-b14e63709ca0&transAbTest=ae803_5","29,47"
"Venda quente Yoga Pilates Anel Círculo Pilates Anel Círculo Mágico Envoltório Slimming a Construção Do Corpo de Fitness Yoga Acessórios foamroller","45","4.7","20","https://pt.aliexpress.com/item/Hot-Sale-Yoga-Pilates-Ring-Pilates-Anillo-Magic-Circle-Wrap-Slimming-Body-Building-Fitness-Circle-Yoga/32879855517.html?ws_ab_test=searchweb0_0,searchweb201602_3_10065_10068_318_10547_319_10548_10696_450_10084_10083_10618_452_535_534_533_10307_532_204_10059_10884_10887_100031_320_10103_448_449,searchweb201603_60,ppcSwitch_0&algo_expid=e041bf52-01fa-476a-a919-b14e63709ca0-13&algo_pvid=e041bf52-01fa-476a-a919-b14e63709ca0&transAbTest=ae803_5","30,30 - 52,18"
"2018 Roda Yoga Pilates Círculos Profissional TPE Yoga Gym Workout Ferramenta de Treinamento de Volta Para A Forma Da Cintura Musculação Para Fitness","69","4.8","44","https://pt.aliexpress.com/item/2017-Yoga-Wheel-Pilates-Professional-TPE-Yoga-Circles-Gym-Workout-Back-Training-Tool-For-Waist-Shape/32791856163.html?ws_ab_test=searchweb0_0,searchweb201602_3_10065_10068_318_10547_319_10548_10696_450_10084_10083_10618_452_535_534_533_10307_532_204_10059_10884_10887_100031_320_10103_448_449,searchweb201603_60,ppcSwitch_0&algo_expid=e041bf52-01fa-476a-a919-b14e63709ca0-14&algo_pvid=e041bf52-01fa-476a-a919-b14e63709ca0&transAbTest=ae803_5","140,44 - 149,22"
"Impresso tapete de Yoga TPE Roda Com Saco de Yoga Anti-escorregar de Volta Curva Círculo Yoga Exercício do Estiramento Auxiliar Casa Equipamentos de Pilates círculo","10","5.0","2","https://pt.aliexpress.com/item/Printed-TPE-Yoga-Wheel-With-Yoga-Bag-Anti-slip-Back-Bend-Yoga-Circle-Stretch-Exercise-Auxiliary/32889248870.html?ws_ab_test=searchweb0_0,searchweb201602_3_10065_10068_318_10547_319_10548_10696_450_10084_10083_10618_452_535_534_533_10307_532_204_10059_10884_10887_100031_320_10103_448_449,searchweb201603_60,ppcSwitch_0&algo_expid=e041bf52-01fa-476a-a919-b14e63709ca0-15&algo_pvid=e041bf52-01fa-476a-a919-b14e63709ca0&transAbTest=ae803_5","190,54 - 212,77"
"Melhor FRP Duplo Aperto Os Músculos Do Corpo Exercício Yoga círculo Pilates Anel Círculo Mágico de Fitness Ferramenta em 38 cm de diâmetro","1","","","https://pt.aliexpress.com/item/Best-FRP-Dual-Grip-Pilates-Ring-Magic-Circle-Muscles-Body-Exercise-Yoga-circle-Fitness-Tool-in/32928255738.html?s=p&ws_ab_test=searchweb0_0,searchweb201602_3_10065_10068_318_10547_319_10548_10696_450_10084_10083_10618_452_535_534_533_10307_532_204_10059_10884_10887_100031_320_10103_448_449,searchweb201603_60,ppcSwitch_0&algo_expid=e041bf52-01fa-476a-a919-b14e63709ca0-16&algo_pvid=e041bf52-01fa-476a-a919-b14e63709ca0&transAbTest=ae803_5","53,02"
"Venda quente Yoga Pilates Anel Círculo Pilates Anel Círculo Mágico Envoltório Slimming a Construção Do Corpo de Fitness Yoga Acessórios foamroller","23","5.0","6","https://pt.aliexpress.com/item/Hot-Sale-Yoga-Pilates-Ring-Pilates-Anillo-Magic-Circle-Wrap-Slimming-Body-Building-Fitness-Circle-Yoga/32891442368.html?ws_ab_test=searchweb0_0,searchweb201602_3_10065_10068_318_10547_319_10548_10696_450_10084_10083_10618_452_535_534_533_10307_532_204_10059_10884_10887_100031_320_10103_448_449,searchweb201603_60,ppcSwitch_0&algo_expid=e041bf52-01fa-476a-a919-b14e63709ca0-17&algo_pvid=e041bf52-01fa-476a-a919-b14e63709ca0&transAbTest=ae803_5","33,94"
"Nova Dupla Aderência Pilates Anel Círculo Mágico Ferramenta de Músculos Do Corpo Yoga Exercício de Fitness","158","4.8","57","https://pt.aliexpress.com/item/New-Dual-Grip-Pilates-Ring-Magic-Circle-Muscles-Body-Exercise-Yoga-Fitness-Tool/32732818713.html?ws_ab_test=searchweb0_0,searchweb201602_3_10065_10068_318_10547_319_10548_10696_450_10084_10083_10618_452_535_534_533_10307_532_204_10059_10884_10887_100031_320_10103_448_449,searchweb201603_60,ppcSwitch_0&algo_expid=e041bf52-01fa-476a-a919-b14e63709ca0-18&algo_pvid=e041bf52-01fa-476a-a919-b14e63709ca0&transAbTest=ae803_5","29,35"
"Forma Cintura Musculação Gym Workout Yoga Pilates Círculos Profissionais de Volta Roda De Treinamento Para Rolamento de Fitness 200 kg 33*12 cm","5","5.0","1","https://pt.aliexpress.com/item/Yoga-Circles-Pilates-Professional-Waist-Shape-Bodybuilding-Gym-Workout-Back-Training-Wheel-For-Fitness-Bearing-200kg/32909918643.html?ws_ab_test=searchweb0_0,searchweb201602_3_10065_10068_318_10547_319_10548_10696_450_10084_10083_10618_452_535_534_533_10307_532_204_10059_10884_10887_100031_320_10103_448_449,searchweb201603_60,ppcSwitch_0&algo_expid=e041bf52-01fa-476a-a919-b14e63709ca0-19&algo_pvid=e041bf52-01fa-476a-a919-b14e63709ca0&transAbTest=ae803_5","78,88"
"Anel de Yoga Círculo Trecho Fascia Massagem Anel Trecho de Fitness Equipamentos de Ginástica Musculação Workout Pilates Yoga Acessórios","18","5.0","7","https://pt.aliexpress.com/item/Yoga-Circle-Stretch-Ring-Fascia-Massage-Workout-Pilates-Ring-Bodybuilding-Fitness-Stretch-Gym-Equipment-Yoga-Accessories/32890206115.html?ws_ab_test=searchweb0_0,searchweb201602_3_10065_10068_318_10547_319_10548_10696_450_10084_10083_10618_452_535_534_533_10307_532_204_10059_10884_10887_100031_320_10103_448_449,searchweb201603_60,ppcSwitch_0&algo_expid=e041bf52-01fa-476a-a919-b14e63709ca0-20&algo_pvid=e041bf52-01fa-476a-a919-b14e63709ca0&transAbTest=ae803_5","17,89"
"Anel de Yoga Círculo Yoga Stretchdline dline Mulheres Em Casa Equipamentos de Fitness Fascia Massagem Pilates Workout Exercício de Musculação","20","4.9","8","https://pt.aliexpress.com/item/dline-Yoga-Circle-Yoga-Stretchdline-Ring-Home-Women-Fitness-Equipment-Fascia-Massage-Workout-Pilates-Bodybuilding-Exercise/32891648653.html?ws_ab_test=searchweb0_0,searchweb201602_3_10065_10068_318_10547_319_10548_10696_450_10084_10083_10618_452_535_534_533_10307_532_204_10059_10884_10887_100031_320_10103_448_449,searchweb201603_60,ppcSwitch_0&algo_expid=e041bf52-01fa-476a-a919-b14e63709ca0-21&algo_pvid=e041bf52-01fa-476a-a919-b14e63709ca0&transAbTest=ae803_5","27,51"
"520mm/430mm Viagem portátil Yoga massagem vara rolo de Exercício da aptidão muscular terapia do ponto do Disparador Miofascial para voltar perna corpo","28","5.0","9","https://pt.aliexpress.com/item/520mm-430mm-Travel-portable-Yoga-massage-stick-Exercise-fitness-roller-muscle-therapy-Myofascial-Trigger-point-for/32718768185.html?ws_ab_test=searchweb0_0,searchweb201602_3_10065_10068_318_10547_319_10548_10696_450_10084_10083_10618_452_535_534_533_10307_532_204_10059_10884_10887_100031_320_10103_448_449,searchweb201603_60,ppcSwitch_0&algo_expid=e041bf52-01fa-476a-a919-b14e63709ca0-22&algo_pvid=e041bf52-01fa-476a-a919-b14e63709ca0&transAbTest=ae803_5","15,21 - 29,58"
"Yoga Círculo Pilates Yoga TPE Roda Do Rolo de Volta Ferramenta de Treinamento de Fitness Emagrecimento Forma Cintura Pilates Anel Mágico","26","5.0","9","https://pt.aliexpress.com/item/KUUBEE-Yoga-Wheel-Pilates-Magic-Circle-Yoga-Ring-Slimming-Fitness-Waist-Shape-Bodybuilding/32825875611.html?ws_ab_test=searchweb0_0,searchweb201602_3_10065_10068_318_10547_319_10548_10696_450_10084_10083_10618_452_535_534_533_10307_532_204_10059_10884_10887_100031_320_10103_448_449,searchweb201603_60,ppcSwitch_0&algo_expid=e041bf52-01fa-476a-a919-b14e63709ca0-23&algo_pvid=e041bf52-01fa-476a-a919-b14e63709ca0&transAbTest=ae803_5","79,76 - 83,95"
"Cm de diâmetro 38 Yoga Pilates Anel Círculo de Fitness 5 Cor Ferramenta Duplo Aperto Aptidão Anel Pilates Magic Circle Os Músculos Do Corpo exercício","","","","https://pt.aliexpress.com/item/38cm-diameter-Yoga-Pilates-Ring-Fitness-Circle-5-Color-Fitness-Tool-Dual-Grip-Pilates-Ring-Magic/32926008632.html?s=p&ws_ab_test=searchweb0_0,searchweb201602_3_10065_10068_318_10547_319_10548_10696_450_10084_10083_10618_452_535_534_533_10307_532_204_10059_10884_10887_100031_320_10103_448_449,searchweb201603_60,ppcSwitch_0&algo_expid=e041bf52-01fa-476a-a919-b14e63709ca0-24&algo_pvid=e041bf52-01fa-476a-a919-b14e63709ca0&transAbTest=ae803_5","53,02"
"Pega dupla Roda de Yoga Círculo Pilates Anel Círculo De Ginástica Gym Workout Treinamento de Volta Ferramenta Emagrecimento Casa Equipamentos de Fitness","49","4.8","26","https://pt.aliexpress.com/item/Dual-Grip-Pilates-Circle-Yoga-Wheel-Gymnastic-Circle-Ring-Gym-Workout-Back-Training-Tool-Home-Slimming/32817104792.html?ws_ab_test=searchweb0_0,searchweb201602_3_10065_10068_318_10547_319_10548_10696_450_10084_10083_10618_452_535_534_533_10307_532_204_10059_10884_10887_100031_320_10103_448_449,searchweb201603_60,ppcSwitch_0&algo_expid=e041bf52-01fa-476a-a919-b14e63709ca0-25&algo_pvid=e041bf52-01fa-476a-a919-b14e63709ca0&transAbTest=ae803_5","44,63"
"TPE Yoga Pilates Círculos Forma Cintura Musculação Profissional ABS Roda Traseira Ferramenta de Treinamento para Fitness Gym Workout Dança Z $","4","","","https://pt.aliexpress.com/item/TPE-Yoga-Circles-Pilates-Professional-Waist-Shape-Bodybuilding-ABS-Gym-Workout-Wheel-Back-Training-Tool-for/32920599412.html?ws_ab_test=searchweb0_0,searchweb201602_3_10065_10068_318_10547_319_10548_10696_450_10084_10083_10618_452_535_534_533_10307_532_204_10059_10884_10887_100031_320_10103_448_449,searchweb201603_60,ppcSwitch_0&algo_expid=e041bf52-01fa-476a-a919-b14e63709ca0-26&algo_pvid=e041bf52-01fa-476a-a919-b14e63709ca0&transAbTest=ae803_5","18,41 - 90,34"
"8 PÇS/SET NOVO ímã de fitness hula hoop massage hula-hoop hoops para crianças kid musculação para mulheres hoops","7","5.0","3","https://pt.aliexpress.com/item/NEW-magnet-fitness-hula-hoop-massage-hoops-hula-hoop-for-children-kid-bodybuilding-for-women-hoops/32829842887.html?ws_ab_test=searchweb0_0,searchweb201602_3_10065_10068_318_10547_319_10548_10696_450_10084_10083_10618_452_535_534_533_10307_532_204_10059_10884_10887_100031_320_10103_448_449,searchweb201603_60,ppcSwitch_0&algo_expid=e041bf52-01fa-476a-a919-b14e63709ca0-27&algo_pvid=e041bf52-01fa-476a-a919-b14e63709ca0&transAbTest=ae803_5","63,92"
"30 CM de Ponto Flutuante Espuma Coluna Pilates Vara 2018 Novo Eva Yoga Balance Bar","3","","","https://pt.aliexpress.com/item/30CM-Floating-Point-Foam-Column-Pilates-Stick-2018-New-Eva-Yoga-Balance-Bar/32881265299.html?ws_ab_test=searchweb0_0,searchweb201602_3_10065_10068_318_10547_319_10548_10696_450_10084_10083_10618_452_535_534_533_10307_532_204_10059_10884_10887_100031_320_10103_448_449,searchweb201603_60,ppcSwitch_0&algo_expid=e041bf52-01fa-476a-a919-b14e63709ca0-28&algo_pvid=e041bf52-01fa-476a-a919-b14e63709ca0&transAbTest=ae803_5","18,21 - 21,44"
"CALOFE Resistência Mágica Anel Ferramentas Círculo Aptidão Mulheres Yoga Exercício Pilates Pilates Emagrecimento Durável Ferramenta de Treinamento da Ginástica Do Esporte","53","4.9","20","https://pt.aliexpress.com/item/CALOFE-Magic-Resistance-Ring-Circle-Women-Yoga-Fitness-Exercise-Tools-Pilates-Slimming-Durable-Pilates-Gym-Training/32870308270.html?ws_ab_test=searchweb0_0,searchweb201602_3_10065_10068_318_10547_319_10548_10696_450_10084_10083_10618_452_535_534_533_10307_532_204_10059_10884_10887_100031_320_10103_448_449,searchweb201603_60,ppcSwitch_0&algo_expid=e041bf52-01fa-476a-a919-b14e63709ca0-29&algo_pvid=e041bf52-01fa-476a-a919-b14e63709ca0&transAbTest=ae803_5","35,65"
"Yoga Círculo Mágico Ferramenta Emagrecimento Yoga Fitness Gym Workout Treinamento de Volta da roda Anel de Pilates","25","5.0","10","https://pt.aliexpress.com/item/Yoga-Circle-Magic-Gym-Workout-Back-Training-Tool-Slimming-Fitness-Yoga-wheel-Pilates-Ring/32888015060.html?ws_ab_test=searchweb0_0,searchweb201602_3_10065_10068_318_10547_319_10548_10696_450_10084_10083_10618_452_535_534_533_10307_532_204_10059_10884_10887_100031_320_10103_448_449,searchweb201603_60,ppcSwitch_0&algo_expid=e041bf52-01fa-476a-a919-b14e63709ca0-30&algo_pvid=e041bf52-01fa-476a-a919-b14e63709ca0&transAbTest=ae803_5","82,40 - 87,91"
"Fabricado em madeira de Nação Yoga Circles Forma Cintura Musculação Gym Workout Yoga Pilates Profissional Roda de Volta Ferramenta de Treinamento de Fitness","24","4.9","10","https://pt.aliexpress.com/item/Wood-Made-Nation-Yoga-Circles-Pilates-Professional-Waist-Shape-Bodybuilding-Gym-Workout-Yoga-Wheel-Back-Training/32868882162.html?ws_ab_test=searchweb0_0,searchweb201602_3_10065_10068_318_10547_319_10548_10696_450_10084_10083_10618_452_535_534_533_10307_532_204_10059_10884_10887_100031_320_10103_448_449,searchweb201603_60,ppcSwitch_0&algo_expid=e041bf52-01fa-476a-a919-b14e63709ca0-31&algo_pvid=e041bf52-01fa-476a-a919-b14e63709ca0&transAbTest=ae803_5","124,83"
"Tapete de Yoga Círculo Sit Fácil Slide Slide Placa Bandeja Velocidade Treinamento de Coordenação Exercício Esteira Esteiras Deslizantes Mãe Ginástica Tapete de Yoga","2","","","https://pt.aliexpress.com/item/Yoga-Mat-Circle-Easy-Sit-Slide-Tray-Coordination-Training-Speed-Slide-Plate-Exercise-Mat-Slide-Mats/32909842299.html?s=p&ws_ab_test=searchweb0_0,searchweb201602_3_10065_10068_318_10547_319_10548_10696_450_10084_10083_10618_452_535_534_533_10307_532_204_10059_10884_10887_100031_320_10103_448_449,searchweb201603_60,ppcSwitch_0&algo_expid=e041bf52-01fa-476a-a919-b14e63709ca0-32&algo_pvid=e041bf52-01fa-476a-a919-b14e63709ca0&transAbTest=ae803_5","35,93"
"Venda quente Yoga Pilates Anel Círculo Pilates Anel Círculo Mágico Envoltório Slimming a Construção Do Corpo de Fitness Yoga Acessórios foamroller","6","5.0","1","https://pt.aliexpress.com/item/Hot-Sale-Yoga-Pilates-Ring-Pilates-Anillo-Magic-Circle-Wrap-Slimming-Body-Building-Fitness-Circle-Yoga/32908396951.html?ws_ab_test=searchweb0_0,searchweb201602_3_10065_10068_318_10547_319_10548_10696_450_10084_10083_10618_452_535_534_533_10307_532_204_10059_10884_10887_100031_320_10103_448_449,searchweb201603_60,ppcSwitch_0&algo_expid=e041bf52-01fa-476a-a919-b14e63709ca0-33&algo_pvid=e041bf52-01fa-476a-a919-b14e63709ca0&transAbTest=ae803_5","21,40"
"Anel Roda de Treinamento Yoga Círculo Pilates Yoga Pilates ABS Profissional Círculos Gym Workout Treinamento de Volta Ferramenta","13","5.0","2","https://pt.aliexpress.com/item/Yoga-Pilates-ring-Training-Wheel-Yoga-Circle-Pilates-Professional-ABS-Circles-Gym-Workout-Back-Training-Tool/32852474317.html?ws_ab_test=searchweb0_0,searchweb201602_3_10065_10068_318_10547_319_10548_10696_450_10084_10083_10618_452_535_534_533_10307_532_204_10059_10884_10887_100031_320_10103_448_449,searchweb201603_60,ppcSwitch_0&algo_expid=e041bf52-01fa-476a-a919-b14e63709ca0-34&algo_pvid=e041bf52-01fa-476a-a919-b14e63709ca0&transAbTest=ae803_5","119,24"
"33 CM * 13 CM Círculos Yoga Formação Rodas Physio Pilates Yoga Ginásio De cintura forma de treino de musculação Equipamentos de Fitness não tóxico","26","4.9","14","https://pt.aliexpress.com/item/33CM-13CM-Yoga-Circles-Training-Wheels-Pilates-Yoga-Physio-Gym-For-waist-shape-bodybuilding-workout-Fitness/32818320151.html?ws_ab_test=searchweb0_0,searchweb201602_3_10065_10068_318_10547_319_10548_10696_450_10084_10083_10618_452_535_534_533_10307_532_204_10059_10884_10887_100031_320_10103_448_449,searchweb201603_60,ppcSwitch_0&algo_expid=e041bf52-01fa-476a-a919-b14e63709ca0-35&algo_pvid=e041bf52-01fa-476a-a919-b14e63709ca0&transAbTest=ae803_5","111,74"
"Cortiça Yoga Círculo Pintado Gravação A Laser Interna Rodada Roda de Exercício Esportes Musculação Slimming Ferramenta Pilates Fitness Roda de Trem","17","5.0","2","https://pt.aliexpress.com/item/Cork-Yoga-Circle-Painted-Inner-Laser-Engraving-Round-Exercise-Wheel-Sports-Bodybuilding-Sliming-Tool-Pilates-Fitness/32829445819.html?ws_ab_test=searchweb0_0,searchweb201602_3_10065_10068_318_10547_319_10548_10696_450_10084_10083_10618_452_535_534_533_10307_532_204_10059_10884_10887_100031_320_10103_448_449,searchweb201603_60,ppcSwitch_0&algo_expid=e041bf52-01fa-476a-a919-b14e63709ca0-36&algo_pvid=e041bf52-01fa-476a-a919-b14e63709ca0&transAbTest=ae803_5","198,72 - 242,63"
"Clássico Preto Roda Yoga Profissional PU Círculo Yoga Gym Workout Treinamento de Volta Ferramenta Pliates Musculação Aptidão Yoga Anel","2","5.0","1","https://pt.aliexpress.com/item/Classical-Black-Yoga-Wheel-Professional-PU-Yoga-Circle-Gym-Workout-Back-Training-Tool-Pliates-Fitness-Bodybuilding/32863936022.html?ws_ab_test=searchweb0_0,searchweb201602_3_10065_10068_318_10547_319_10548_10696_450_10084_10083_10618_452_535_534_533_10307_532_204_10059_10884_10887_100031_320_10103_448_449,searchweb201603_60,ppcSwitch_0&algo_expid=e041bf52-01fa-476a-a919-b14e63709ca0-37&algo_pvid=e041bf52-01fa-476a-a919-b14e63709ca0&transAbTest=ae803_5","240,76"
"TPE Yoga Pilates Círculos Forma Cintura Musculação Profissional ABS Roda Traseira Ferramenta de Treinamento Para Fitness Gym Workout Yoga","128","4.8","59","https://pt.aliexpress.com/item/TPE-Yoga-Circles-Pilates-Professional-Waist-Shape-Bodybuilding-ABS-Gym-Workout-Yoga-Wheel-Back-Training-Tool/32866360943.html?ws_ab_test=searchweb0_0,searchweb201602_3_10065_10068_318_10547_319_10548_10696_450_10084_10083_10618_452_535_534_533_10307_532_204_10059_10884_10887_100031_320_10103_448_449,searchweb201603_60,ppcSwitch_0&algo_expid=e041bf52-01fa-476a-a919-b14e63709ca0-38&algo_pvid=e041bf52-01fa-476a-a919-b14e63709ca0&transAbTest=ae803_5","90,62"
"Cortiça + ABS Roda Yoga/Anel Milagre Círculo Yoga Pilates Anéis de Ginástica Em Casa Equipamentos de Fitness Rolo De Espuma Pilates Priora acessórios","8","5.0","5","https://pt.aliexpress.com/item/Cork-ABS-Yoga-Wheel-Ring-Miracle-Yoga-Circle-Pilates-Rings-Home-Gym-Fitness-Equipments-Priora-Foam/32831091589.html?ws_ab_test=searchweb0_0,searchweb201602_3_10065_10068_318_10547_319_10548_10696_450_10084_10083_10618_452_535_534_533_10307_532_204_10059_10884_10887_100031_320_10103_448_449,searchweb201603_60,ppcSwitch_0&algo_expid=e041bf52-01fa-476a-a919-b14e63709ca0-39&algo_pvid=e041bf52-01fa-476a-a919-b14e63709ca0&transAbTest=ae803_5","166,99"
